title,author,image,desc,download_link,pages,publisher,year,language,file
Art Therapy and Ad Hd: Diagnostic and Therapeutic Approaches,Diane Stein Safran,https://covers.zlibcdn2.com/covers100/books/54/38/6e/54386e05045ff5697c71df4d4bc86c77.jpg,"
                    Attention Deficit/Hyperactivity Disorder is increasingly being diagnosed in people of all ages, and this book demonstrates how art therapy can not only assist with diagnosis, but also provides a valuable means of helping to improve skills such as concentration and focus, boost self-esteem, and cope with impulsivity. Educational social skills art groups can help with understanding of AD/HD in addition to teaching strategies to relieve the symptoms. Art therapy is also important for alleviating feelings of isolation and confusion that may come with the diagnosis, and, as an ongoing process, it can be a useful tool for checking clients' progress from the initial assessment onwards. In the first part of her book, the author explores ways of using art therapy and of setting up art therapy groups. Her advice and practical suggestions will be useful to anyone with an interest in AD/HD. The later chapters offer therapists more detailed guidance on therapy sessions with clients with AD/HD.  Practical and informative, and based on the author's long experience with art therapy and AD/HD, this will be a valuable book for therapists, mental health professionals, and people who live or work with AD/HD.                ",https://1lib.in/dl/1069212/4bc9cc,162,Jessica Kingsley,2002,english,"PDF, 1.91 MB"
Breast Cancer: Diagnostic Imaging and Therapeutic Guidance,Uwe Fischer,https://covers.zlibcdn2.com/covers100/books/08/5d/15/085d158d8797b9d6c97ced93eb8f60d6.jpg,Unknown,https://1lib.in/dl/5405602/d293f6,254,Thieme Medical Publishers,2017,english,"PDF, 36.55 MB"
Special pathology and diagnostics: with therapeutic hints,Charles Gottlieb Raue,https://covers.zlibcdn2.com/covers100/books/66/93/25/6693257b51a3d6b8e0d6f20a8f61c7cf.jpg,"
                    Philadelphia. Boericke&Tafel. 1896. -1050 p.Английский язык.Специальная патология и диагностика: с терапевтическими намеками.Книга была переиздана несколько раз и стала настольной для многих гомеопатов. В ней подробно описано гомеопатическое лечение всевозможных заболеваний по различным системам организма.                ",https://1lib.in/dl/3255784/148099,Unknown,Unknown,Unknown,english,"DJVU, 34.85 MB"
"Ophthalmic Drugs: Diagnostic and Therapeutic Uses, 5th Edition",Graham Hopkins BPharm  PhD  MRPharm,https://covers.zlibcdn2.com/covers100/books/a6/d6/39/a6d639b87f1d6b21386d31b7247beed9.jpg,"
                    Completely updated and revised, this classic book provides the essential information on ocular therapeutics for the modern optometrist.  Retaining all the features that made previous editions so popular, the new fifth edition continues to provide a basic grounding in pharmacological principles and drug types, before moving on to illustrate the scope of ocular therapeutics in the management of common acute conditions affecting the anterior segment of the eye. Throughout the text there are numerous new clinical notes and ready-reference tables, making for greater ease of use than ever before.Greatly expanded text including an illustrated section on ocular disease and its treatmentNew drugs included, processes and procedures updated and revisedNow all completely redesigned in full colour throughoutFeatures ready-reference tables and clinical notesCompletely updated and revised to reflect modern practiceClinically orientated and appropriate for the practitioner as well as the studentWritten by experts with years of practical experience in teaching and training as well as dispensing these essential preparations                ",https://1lib.in/dl/938360/628a87,333,Unknown,2007,english,"PDF, 4.66 MB"
The ''Childhood Hand that Disturbs'' Projective Test: A Diagnostic and Therapeutic Drawing Test,Roseline Davido,https://covers.zlibcdn2.com/covers100/books/c0/51/36/c05136bfbb10e7d0e7da4583597c7663.jpg,"
                    The Childhood Hand that Disturbs (CHaD), a new projective test, is a diagnostic and therapeutic tool that is broadly applicable, but particularly effective with abused, depressed, and suicidal subjects. While the CHaD has the advantage of being quick and easy to administer--it takes an average of ten minutes to perform--it is reliable and applicable to both young and old. It is a useful complement to traditional batteries such as the Rorschach and Draw-a-Family, and self-assessment questionnaires. What makes the CHaD different is that it is a free drawing exam, and one that taps one of the most highly symbolic parts of the body: the hand. The CHaD has been tested on normal and pathological individuals for over ten years. Clear guidelines can now be set down for administration, testing, and interpretation. Obviously, a projective test can never be more sensitive than the professional who uses it, but it is Davido's intention that the theoretical underpinnings and her presentations of case studies along with the drawings will help other practitioners deal better with the needs of their patients.                ",https://1lib.in/dl/917135/feadc7,200,Unknown,1994,english,"PDF, 9.48 MB"
Lung Cancer: Diagnostic and Therapeutic Methods and Reviews,Driscoll B.,https://covers.zlibcdn2.com/covers100/books/be/19/9e/be199e4d77969d75b5c5b151f1cc0d71.jpg,"
                    Leading physician scientists and noted researchers describe step-by-step techniques for lung cancer diagnosis based on the molecular analysis of clinical samples. These experts review currently accepted treatments and outline a variety of novel therapies, including those based on gene therapy, immunotherapy, and chemoprevention, and show how these newly improved techniques can give a better appreciation of the prognosis associated with the particular mutation uncovered by the technique. These methods use a variety of molecular techniques, including the manipulation of gene expression and the alteration of immune status, to combat lung cancer.                ",https://1lib.in/dl/460413/6714d8,721,Unknown,2002,english,"PDF, 12.82 MB"
"Biological, Diagnostic and Therapeutic Advances in Alzheimer's Disease: Non-Pharmacological Therapies for Alzheimer's Disease",Ghulam Md Ashraf,https://covers.zlibcdn2.com/covers100/books/7c/11/16/7c111642ed4a4c96b4a7db872920579c.jpg,"
This book discusses the latest research into the highly prevalent neurodevelopmental disease most commonly associated with aging: Alzheimer’s disease (AD). Even after years of research, Alzheimer’s disease is still far from being cured. It presents a range of common symptoms in the form of behavioral and cognitive impairments. This book describes the symptoms and the biology behind them. The contents covers latest findings on the genetics involved and various factors and pathways influencing disease development. It also covers various non-pharmacological therapies like immunotherapy, use of natural products, and employing nanotechnology in both the detection and treatment of AD. This book also highlights the role of diet and nutrition in healthy aging. Given its scope, it offers a valuable asset for researchers and clinicians alike.  ",https://1lib.in/dl/5402845/ad00ac,Unknown,Springer Singapore,2019,english,"PDF, 7.59 MB"
Breast cancer : diagnostic imaging and therapeutic guidance,médecin. Uwe Fischer,https://covers.zlibcdn2.com/covers100/books/67/92/5f/67925f8777d9a87fdfd49bd0e96cec42.jpg,Unknown,https://1lib.in/dl/5611245/36d000,239,Unknown,2018,english,"PDF, 37.37 MB"
"Thymus Gland Pathology: Clinical, Diagnostic and Therapeutic Features",Corrado Lavini,https://covers.zlibcdn2.com/covers100/books/e3/83/00/e383007b77a2e25061abdc6e74f846a8.jpg,"
                    The thymus role has been unclear until the second half of 1900. Nowadays its function is much clearer, and the increase of the thymus pathology is a challenging problem that can be better faced. The most important thymus diseases often require a multidisciplinary approach, and involve several specialists, from the clinical immunologist to the neurologist and the radiologist, from the surgeon to the anaesthesist and the oncologist.  The volume deals with the whole range of this gland pathology and describes the most recent surgical and non surgical techniques. Written by international experts, it will be very useful for all those involved in the treatment of these diseases.                ",https://1lib.in/dl/887865/e54f18,274,Springer,2008,english,"PDF, 35.46 MB"
The Emotional Life Interview: A Psychosocial Diagnostic and Therapeutic Procedure,Henry,https://covers.zlibcdn2.com/covers100/books/67/3f/55/673f5587ec79dce0ff7d18d773b4a881.jpg,"
                    The purpose of this book is to introduce mental health professionals to the Emotional Life Interview that offers therapy to those with mental health problems in a more effective and time-sensitive process. It meets today s pressures to provide essential care at less cost. The Emotional Life Interview (ELI) involves asking each client seven questions about five negative feelings and emotions (fear, anger, shame, guilt, and sadness) and six questions about two positive feelings and emotions (pride and happiness). The process takes the practitioner into the emotional life of a client as no other procedure does. Major sections of the book discuss feelings, emotions, and psychotherapy; meaning, arousal, and the construction of emotions; and the use of the ELI in psychosocial treatment. In addition, nine complete chapters are devoted to case histories which illustrate how important feelings, emotions, and relationships are in mental health problems. These case study interviews become conversations in which the clients reveal the character of their consciousness with respect to their emotional lives. The ELI questions presented in the case studies require clients to represent their thoughts and actions in words and to tell their emotional life stories in a manner that is itself therapeutic. The life stories show in bold relief where changes are needed. The Emotional Life Interview provides a framework for emotional life education. The interview puts diagnosis and psychotherapy on the same continuum and makes therapy and emotional life education a viable healthcare option. The book represents a valuable new tool for all clinical and counseling psychologists, clinical social workers, psychiatrists, and primary care providers. It will also serve as a resource in the helping professions, welfare work, and human services.                ",https://1lib.in/dl/2724873/935044,192,Charles C Thomas Pub Ltd,2013,english,"PDF, 4.31 MB"
"Diseases of the Gastro-Intestinal Tract: Some Diagnostic, Therapeutic and Fundamental Aspects",Prof. J. Dankmeijer M.D. (auth.),https://covers.zlibcdn2.com/covers100/books/bd/b9/77/bdb977ed874a5721c07c74ff70085aed.jpg,"
The Leiden-Edinburgh Boerhaave Course on 'The Gastro-intestinal Tract', held in Leiden on October 29 and 30, 1969, resulted from the renewed co-operation between the Medical Faculties of Edinburgh and Leiden, based on very old ties. As one will know, the Edinburgh Faculty of Medi­ cine was founded in 1726 on the principles guiding the Leiden Faculty of Medicine at that time, on the instigation of John Monro I, who had studied medicine in Leiden under the famous Boerhaave. These old ties were revived some 8 years ago, first by students, later by the Faculties themselves, with the special purpose to facilitate and en­ large the exchange of medical knowledge between two medical centres. One of the results of this was that it was considered whether physicians from both countries could not profit from the knowledge gained specific­ ally in both these faculties by letting the investigators from both faculties tell about their work within the framework of courses for post-academic medical training, in Leiden called the 'Boerhaave Courses'. ",https://1lib.in/dl/2241687/2660f6,138,Springer Netherlands,1970,english,"PDF, 6.13 MB"
Diagnostic and Therapeutic Procedures in Gastroenterology: An Illustrated Guide,Nam Q. Nguyen MBBS(Hons),https://covers.zlibcdn2.com/covers100/books/2d/71/a9/2d71a9dbc493c4a6756ccfb8c773fd4f.jpg,"
Diagnostic and Therapeutic Procedures in Gastroenterology: An Illustrated Guide is a comprehensive volume describing procedures for the gastrointestinal tract in a simple way. Artistic illustrations are provided to educate the physician about procedures, and to provide not only clear descriptions of the changes in the anatomy and physiology, but also to provide advice on medical management of the post-procedure patient. Clear, detailed, artist-rendered illustrations of the anatomy are included as well as appro¬priate, radiological images. Chapters describe in detail the indications, contraindications, anatomical alterations, and physiological alter¬ations that result from various operations and procedures. Comparisons between alternative operations, complications, medical management issues, and costs are also discussed. Diagnostic and Therapeutic Procedures in Gastroenterology: An Illustrated Guide is a unique volume, written primarily for primary care physicians and general internists. It is also suitable for medical students, residents, nurses and nurse practi¬tioners, nutritionists, dietitians and various subspecialists, who take care of patients with gastrointestinal disorders. ",https://1lib.in/dl/979303/698501,383,Humana Press,2011,english,"PDF, 21.16 MB"
Peripheral Vascular Disease: Basic Diagnostic and Therapeutic Approaches 3rd Edition,George S Abela,https://covers.zlibcdn2.com/covers100/books/1b/fb/60/1bfb60a37c0f9c1851bb0796c56251fd.jpg,"
                    Written by cardiologists and subspecialists who treat peripheral vascular problems, this text provides quick and practical guidance on the diagnosis and management of peripheral vascular disease (PVD). Coverage begins with anatomy, etiology, signs and symptoms, and risk factors and proceeds to medical therapy, noninvasive and invasive diagnosis, interventional therapy, and surgical treatment. The book includes sections on training of cardiovascular fellows, residents, and house staff; venous disease; systemic manifestations of PVD; the economic impact of PVD; and billing and coding.                ",https://1lib.in/dl/1086222/dd9e0f,Unknown,Lippincott Williams & Wilkins,2004,english,"CHM, 30.81 MB"
"Retinal Degenerations: Biology, Diagnostics, and Therapeutics",Joyce Tombran-Tink,https://covers.zlibcdn2.com/covers100/books/9b/b0/ee/9bb0eebfc64bc8adf2422d8ab3ea98be.jpg,"
In Retinal Degenerations: Biology, Diagnostics, and Therapeutics, editors Joyce Tombran-Tink and Colin Barnstable present new and noteworthy research into retinal diseases. Written by renowned scientific investigators, this innovative collection of treatment strategies and technological discoveries allows for the realistic translation of research into practice. Following an exciting preface describing the diagnosis and treatment of retinal degenerations from antiquity to the modern era, this four-part volume begins with thought-provoking portraits of the reality of life with retinal degenerations, as experienced by sufferers of the disease.  In Part II, researchers and practitioners examine seven different retinal diseases, including: age-related macular degeneration, Leber Congenital Amaurosis, Macular Degeneration, Stargardt Disease, X-Linked Juvenile Retinoschisis, Usher Syndrome, and Retinitis Pigmentosa. Part III discusses our current understanding of the underlying mechanisms of retinal degeneration, and in Part IV, the challenges of therapeutic strategies for retinal degenerative diseases are emphasized as researchers discuss cutting-edge treatments. Retinal Degenerations: Biology, Diagnostics, and Therapeutics brings the scientific community to the frontline of research into diseases of the retina and challenges scientists in academia and the pharmaceutical industry to develop innovative strategies for the translation of investigative research into viable therapeutics. ",https://1lib.in/dl/611664/204629,487,Humana Press,2007,english,"PDF, 7.89 MB"
Human Modelling for Bio-Inspired Robotics. Mechanical Engineering in Assistive Technologies,Jun Ueda,https://covers.zlibcdn2.com/covers100/books/bf/2f/5e/bf2f5e2285c5806f3f2e0538236413ad.jpg,"
Human Modelling for Bio-inspired Robotics: Mechanical Engineering in Assistive Technologies presents the most cutting-edge research outcomes in the area of mechanical and control aspects of human functions for macro-scale (human size) applications. Intended to provide researchers both in academia and industry with key content on which to base their developments, this book is organized and written by senior experts in their fields.  Human Modeling for Bio-Inspired Robotics: Mechanical Engineering in Assistive Technologies offers a system-level investigation into human mechanisms that inspire the development of assistive technologies and humanoid robotics, including topics in modelling of anatomical, musculoskeletal, neural and cognitive systems, as well as motor skills, adaptation and integration. Each chapter is written by a subject expert and discusses its background, research challenges, key outcomes, application, and future trends.",https://1lib.in/dl/2800790/1e4583,Unknown,Academic Press,2016,english,"PDF, 22.43 MB"
A New Bio-inspired Optimization Algorithm Based on the Self-defense Mechanism of Plants in Nature,Camilo Caraveo,https://covers.zlibcdn2.com/covers100/books/c0/c0/b6/c0c0b6da8cc4a34efae9653a8fae49f3.jpg,"
This book presents a new meta-heuristic algorithm, inspired by the self-defense mechanisms of plants in nature. Numerous published works have demonstrated the various self-defense mechanisms (survival strategies) plants use to protect themselves against predatory organisms, such as herbivorous insects. The proposed algorithm is based on the predator–prey mathematical model originally proposed by Lotka and Volterra, consisting of two nonlinear first-order differential equations, which allow the growth of two interacting populations (prey and predator) to be modeled. The proposed meta-heuristic is able to produce excellent results in several sets of benchmark optimization problems. Further, fuzzy logic is used for dynamic parameter adaptation in the algorithm. ",https://1lib.in/dl/4982290/b350eb,Unknown,Springer International Publishing,2019,english,"PDF, 1.90 MB"
"Bio-inspired structured adhesives : Biological prototypes, fabrication, tribological properties, contact mechanics, and novel concepts",Gorb,https://covers.zlibcdn2.com/covers100/books/a0/76/84/a0768432183560e6df8b1c39556c8f95.jpg,"
This book deals with the adhesion, friction and contact mechanics of living organisms. Further, it presents the remarkable adhesive abilities of the living organisms which inspired the design of novel micro- and nanostructured adhesives that can be used in various applications, such as climbing robots, reusable tapes, and biomedical bandages. The technologies for both the synthesis and construction of bio-inspired adhesive micro- and nanostructures, as well as their performance, are discussed in detail. Representatives of several animal groups, such as insects, spiders, tree frogs, and lizards, are able to walk on (and therefore attach to) tilted, vertical surfaces, and even ceilings in different environments. Studies have demonstrated that their highly specialized micro- and nanostructures, in combination with particular surface chemistries, are responsible for this impressive and reversible adhesion. These structures can maximize the formation of large effective contact areas on surfaces of varying roughness and chemical composition under different environmental conditions. ",https://1lib.in/dl/3376039/9c80c1,348,Unknown,2017,english,"PDF, 13.84 MB"
Biological and Bio-inspired Nanomaterials: Properties and Assembly Mechanisms,Sarah Perrett,https://covers.zlibcdn2.com/covers100/books/8e/f7/43/8ef7430b81ae9137d1d9d00651abf3ba.jpg,"
This book summarizes naturally occurring and designed bio-inspired molecular building blocks assembled into nanoscale structures. It covers a fascinating array of biomimetic and bioinspired materials, including inorganic nanozymes, structures formed by DNA origami, a wide range of peptide and protein-based nanomaterials, as well as their applications in diagnostics and therapeutics. The book elucidates the mechanism of assembly of these materials and characterisation of their mechanical and physico-chemical properties which inspires readers not only to exploit the potential applications of nanomaterials, but also to understand their potential risks and benefits. It will be of interest to a broad audience of students and researchers spanning the disciplines of biology, chemistry, engineering, materials science, and physics.  ",https://1lib.in/dl/5402876/2c5522,Unknown,Springer Singapore,2019,english,"PDF, 12.56 MB"
Bio- and Chemo-Mechanical Processes in Geotechnical Engineering: Géotechnique Symposium in Print 2013,Lyesse Laloui,https://covers.zlibcdn2.com/covers100/books/96/60/74/96607480c64fa8e1b8e2988539ec7d8c.jpg,"
                    In recent years, substantial advances have been made in understanding the coupling between chemical and biological processes and mechanical and hydraulic behaviours in soils and rocks. At the same time, experimentation and modelling capabilities have progressed significantly, allowing effective design of geotechnical applications. The need for such analyses arises, for example, in chemical and biological soil improvement; nuclear, hazardous and municipal waste containment; petroleum and natural gas extraction; methane hydrate exploitation; CO2 sequestration; and assessment of pavement durability.

The seventeenth Géotechnique Symposium in Print took place at the Institution of Civil Engineers on 3 June 2013 and sought to address the new challenges that are emerging from the interactions between multi-physical phenomena. These proceedings bring together the international research presented at the symposium and published across two issues of Géotechnique as well as additional subsequent research published in the journal.

The papers selected for the symposium cover a wide range of geotechnical processes, including:

- Experimental analysis and constitutive modelling of the bio- and chemo-mechanical behaviour of geomaterials.
- Effects of changes in the pore water chemistry on soil and rock behaviour.
- Interactions between geometrical scales of diverse biological, chemical, physical and mechanical processes.
- Case studies of chemical and biological soil modifications.
- Applications of bio- and chemo-mechanical models in emerging technologies.

Bio- and Chemo- Mechanical Processes in Geotechnical Engineering provides researchers and practitioners with a comprehensive introduction to the recent advances in the area and invaluable insight into the developments within this emerging field.                ",https://1lib.in/dl/2459137/a7d529,Unknown,ICE Publishing,2014,english,"PDF, 19.28 MB"
Advances in Bio-Mechanical Systems and Materials,Ashkan Javadzadegan,https://covers.zlibcdn2.com/covers100/books/37/58/a2/3758a2b1990a40d50951ec147f73781a.jpg,"
This monograph presents the latest results related to bio-mechanical systems and materials. The bio-mechanical systems with which his book is concerned are prostheses, implants, medical operation robots and muscular re-training systems. To characterize and design such systems, a multi-disciplinary approach is required which involves the classical disciplines of mechanical/materials engineering and biology and medicine. The challenge in such an approach is that views, concepts or even language are sometimes different from discipline to discipline and the interaction and communication of the scientists must be first developed and adjusted. Within the context of materials' science, the book covers the interaction of materials with mechanical systems, their description as a mechanical system or their mechanical properties. ",https://1lib.in/dl/2159679/55b7de,146,Springer International Publishing,2013,english,"PDF, 8.31 MB"
Buried Waste in the Seabed; Acoustic Imaging and Bio-toxicity,Philippe Blondel,https://covers.zlibcdn2.com/covers100/books/d9/b1/7a/d9b17a387ec63dab9c37e493bf335c69.jpg,"
                    Buried waste on the seabed is a major source of pollution. But, very often, waste sites are not known until aserious problem occurs, or are not adequately mapped. Recent examples around Europe include WWI and WWII ammunition dump sites (e.g. Beufort Dyke in the UK), dumped nuclear submarines in the Arctic Seas, clandestine or hidden toxic-waste in the Baltic Sea and the North Sea.. Even if properly documented, waste sites evolve with time (dumped material can movewith currents and tides, especially on a scale of decades; toxic-material barrels can corrode and leak). This book shows the results of a concerted EU-funded effort to tackle this problem and find innovative ways to identify and map toxic waste sites ona the seabed, whether they have been covered with sediments or not. These results are applicable to any region on the seabed in the entire world.                ",https://1lib.in/dl/679034/526837,244,Springer,2006,english,"PDF, 7.05 MB"
Bio-Mechanical,Lindsey E.M.,https://covers.zlibcdn2.com/covers100/books/ce/56/01/ce5601770dbdd64f3fd9cb44b3a63cde.png,Unknown,https://1lib.in/dl/5280977/95e815,Unknown,Unknown,2019,english,"EPUB, 236 KB"
