title,author,image,desc,download_link,pages,publisher,year,language,file
Time-Frequency Signal Analysis and Processing: A Comprehensive Review,Boualem Boashash,https://covers.zlibcdn2.com/covers100/books/ad/8a/66/ad8a66ffd63e67832fd56fe971abe64d.jpg,"
Time-Frequency Signal Analysis and Processing (TFSAP) is a collection of theory, techniques and algorithms used for the analysis and processing of non-stationary signals, as found in a wide range of applications including telecommunications, radar, and biomedical engineering. This book gives the university researcher and R&D engineer insights into how to use TFSAP methods to develop and implement the engineering application systems they require.   New to this edition:  New sections on Efficient and Fast Algorithms; a ""Getting Started"" chapter enabling readers to start using the algorithms on simulated and real examples with the TFSAP toolbox, compare the results with the ones presented in the book and then insert the algorithms in their own applications and adapt them as needed. Two new chapters and twenty three new sections, including updated references.New topics including: efficient algorithms for optimal TFDs (with source code), the enhanced spectrogram, time-frequency modelling, more mathematical foundations, the relationships between QTFDs and Wavelet Transforms, new advanced applications such as cognitive radio, watermarking, noise reduction in the time-frequency domain, algorithms for Time-Frequency Image Processing, and Time-Frequency applications in neuroscience (new chapter).  A comprehensive tutorial introduction to Time-Frequency Signal Analysis and Processing (TFSAP), accessible to anyone who has taken a first course in signalsKey advances in theory, methodology and algorithms, are concisely presented by some of the leading authorities on the respective topicsApplications written by leading researchers showing how to use TFSAP methods ",https://1lib.in/dl/2662716/473b00,1056,Academic Press,2015,english,"PDF, 40.18 MB"
"Advanced Signal Processing Handbook: Theory and Implementation for Radar, Sonar, and Medical Imaging Real Time Systems",Stergios Stergiopoulos,https://covers.zlibcdn2.com/covers100/books/b2/14/40/b214406b2bbb520c2402200e96f40961.jpg,"
                    Beyond offering an outstanding introduction to the principles and applications of advanced signal processing, this handbook presents the most recent theoretical and practical developments in the field. Expert contributors identify applications and assess the impact of and improvements in radar, sonar, and medical imaging systems. This handbook develops a generic processing structure, based on the similarities between radar, sonar, and medical imaging systems, to present an introduction to these new principles and applications. Bridging a number of related fields, it guides the reader into the next generation of active and passive real-time systems.                ",https://1lib.in/dl/465553/b3ce9d,727,CRC Press,2000,english,"PDF, 52.12 MB"
"Statistical signal processing: detection, estimation, and time series analysis",Louis Scharf,https://covers.zlibcdn2.com/covers100/books/2f/c1/d9/2fc1d9f2b8dc2ca060093b06d311f6b9.jpg,"
                    This book is very comprehensive, covering all essential topics in signal detection, all down to the bottom. However, it requires a very high level of mathematical maturity and understanding as all derivations are pretty jumpy with slight notational abuses.                ",https://1lib.in/dl/685918/5f3011,544,Addison-Wesley Pub. Co,1991,english,"PDF, 20.84 MB"
DSP for Embedded and Real-Time Systems. Expert Guide,Oshana R.,https://covers.zlibcdn2.com/covers100/books/35/6d/15/356d157d6b9b2fe7edda309de947078a.jpg,"
                    Издательство Newnes, 2012, -625 pp.This Expert Guide gives you the techniques and technologies in digital signal processing (DSP) to optimally design and implement your embedded system. Written by experts with a solutions focus, this encyclopedic reference gives you an indispensable aid to tackling the day-to-day problems you face in using DSP to develop embedded systems.With this book you will learn:- A range of development techniques for developing DSP code- Valuable tips and tricks for optimizing DSP software for maximum performance- The various options available for constructing DSP systems from numerous software components- The tools available for developing DSP applications- Numerous practical guidelines from experts with wide and lengthy experience of DSP application development Features:- Several areas of research being done in advanced DSP technology- Industry case studies on DSP systems development- DSP software development tools available for download and evaluation DSP for Embedded and Real-Time Systems is the reference for both the beginner and experienced, covering most aspects of using today's DSP techniques and technologies for designing and implementing an optimal embedded system. - The only complete reference which explains all aspects of using DSP in embedded systems development making it a rich resource for everyday use- Covers all aspects of using today's DSP techniques and technologies for designing and implementing an optimal embedded system - Enables the engineer to find solutions to all the problems they will face when using DSPDSP in Embedded Systems: A RoadmapIntroduction to Digital Signal ProcessingOverview of Real-time and Embedded SystemsOverview of Embedded Systems Development Lifecycle Using DSP Programmable DSP ArchitecturesFPGA in Wireless Communications ApplicationsThe DSP Hardware/Software ContinuumOverview of DSP AlgorithmsHigh-level Design Tools for Complex DSP ApplicationsOptimizing DSP Software – Benchmarking and Profiling DSP SystemsOptimizing DSP Software - High-level Languages and Programming ModelsOptimizing DSP Software - Code OptimizationDSP Optimization - Memory OptimizationSoftware Optimization for Power ConsumptionDSP Operating SystemsManaging the DSP Software Development EffortMulticore Software Development for DSPDeveloping and Debugging a DSP ApplicationCase StudiesLTE Baseband Software DesignDSP for Medical DevicesVoice Over IP DSP Software SystemSoftware Performance Engineering of an Embedded System DSP ApplicationSpecifying Behavior of Embedded SystemsDSP for Software Defined Radio                ",https://1lib.in/dl/3035847/917707,Unknown,Unknown,Unknown,english,"PDF, 21.13 MB"
"Real-Time Digital Signal Processing from MATLAB to C with the TMS320C6x DSPs, Third Edition",Morrow,https://covers.zlibcdn2.com/covers100/books/af/22/05/af2205ab80bc9df03af9ddbb91b555ba.jpg,Unknown,https://1lib.in/dl/4977161/4b4d53,481,Chapman and Hall/CRC,2016,english,"PDF, 16.26 MB"
"Advanced signal processing on brain event-related potentials : filtering ERPs in time, frequency and space domains sequentially and simultaneously",Cong,https://covers.zlibcdn2.com/covers100/books/6a/f2/6e/6af26e7ed38542e4632930516edf7476.jpg,Unknown,https://1lib.in/dl/2571884/f6c7f1,224,World Scientific,2015,english,"PDF, 15.74 MB"
"Quadrature Amplitude Modulation: From Basics to Adaptive Trellis-Coded, Turbo-Equalised and Space-Time Coded OFDM, CDMA and MC-CDMA Systems",Lajos L. Hanzo,https://covers.zlibcdn2.com/covers100/books/8e/5b/0c/8e5b0c8a2cc6c524d5ec4d334d315592.jpg,Unknown,https://1lib.in/dl/1133299/c64e9c,1135,Wiley-IEEE Press,2004,english,"DJVU, 27.98 MB"
"Time-Frequency Signal Analysis and Processing, Second Edition: A Comprehensive Reference",Boualem Boashash,https://covers.zlibcdn2.com/covers100/books/c5/bb/d9/c5bbd91a07cc66f513842e75d21d7297.jpg,"
Time-Frequency Signal Analysis and Processing (TFSAP) is a collection of theory, techniques and algorithms used for the analysis and processing of non-stationary signals, as found in a wide range of applications including telecommunications, radar, and biomedical engineering. This book gives the university researcher and R&D engineer insights into how to use TFSAP methods to develop and implement the engineering application systems they require.   New to this edition:  New sections on Efficient and Fast Algorithms; a ""Getting Started"" chapter enabling readers to start using the algorithms on simulated and real examples with the TFSAP toolbox, compare the results with the ones presented in the book and then insert the algorithms in their own applications and adapt them as needed. Two new chapters and twenty three new sections, including updated references.New topics including: efficient algorithms for optimal TFDs (with source code), the enhanced spectrogram, time-frequency modelling, more mathematical foundations, the relationships between QTFDs and Wavelet Transforms, new advanced applications such as cognitive radio, watermarking, noise reduction in the time-frequency domain, algorithms for Time-Frequency Image Processing, and Time-Frequency applications in neuroscience (new chapter).  A comprehensive tutorial introduction to Time-Frequency Signal Analysis and Processing (TFSAP), accessible to anyone who has taken a first course in signalsKey advances in theory, methodology and algorithms, are concisely presented by some of the leading authorities on the respective topicsApplications written by leading researchers showing how to use TFSAP methods ",https://1lib.in/dl/3419509/3a0674,1056,Academic Press,2016,english,"PDF, 70.82 MB"
Probability and random processes: using MATLAB with applications to continuous and discrete time systems,Donald G. Childers,https://covers.zlibcdn2.com/covers100/books/87/b9/c7/87b9c7218ac21ffdb2b9426230853d30.jpg,"
                    FOR INFORMATION ABOUT THE SOLUTIONS MANUAL AND MATLAB SOFTWARE, PLEASE CONTACT MICHELLE FLOMENHOFT AT michelle_flomenhoft@mcgraw-hill.com  PROBABILITY AND RANDOM PROCESSES USING MATLAB, 1/e, is designed for an undergraduate senior level or first year graduate level course in probability and random processes. The course is introductory and is to be covered in one semester. The course covers both continuous- and discrete-time systems. Many of the applications are drawn from signal processing and communications.                ",https://1lib.in/dl/538654/b0c2ca,443,Richard D Irwin,1997,english,"PDF, 20.16 MB"
"Real-Time Digital Signal Processing: Implementations, Application and Experiments with the TMS320C55X",Sen M. Kuo,https://covers.zlibcdn2.com/covers100/books/84/f9/43/84f943385a0f6b1b64a3a63ab534ac1b.jpg,"
                    The rapid advancement in digital technology in recent years has allowed the implementation of incredibly sophisticated digital signal processing (DSP) algorithms that make real-time tasks feasible. Real-time DSP is currently a very hot subject in today's engineering fields fuelled by the ever-increasing demand for high-performance digital signal processors. The TMS320C55x is the latest of Texas Instrument's line of highly successful DSP chips, which is anticipated to dominate the market in 2001.Placing emphasis on the practical aspects of real time DSP concepts and applications by taking a systems design, implementation and simulation approach, this text bridges the gap in the existing DSP literature which covers theory, MATLAB and C and Lab manuals. A hands-on, tutorial approach enables the understanding of real-time DSP systems principles and real-world applications using MATLAB, C and various assembly programs based on TI's TMS320C55x.    * Tutorial based presentation, allowing the reader to master the theory of digital signal processing and the important skill of real-time DSP design and implementation techniques.    * Focuses on practical aspects of real-time DSP concepts and applications from a system design and implementation point of view    * Accompanying CD-ROM containing MATLAB and C assembly programs will allow a hands-on illustration of real-time DSP application    * For readers with access to a TI DSP lab, an Evaluation Module (EVM) with Code Compressor Studio (CCS) of TMS320C55x will be integrated into lab experiments, projects and applications from in-text references A valuable, leading edge resource for senior graduate students of digital signal processing and practising engineers developing real-time DSP applications.                ",https://1lib.in/dl/462626/bb3b37,503,Wiley,2001,english,"PDF, 3.80 MB"
Real-time digital signal processing from MATLAB to C with the TMS320C6x DSPs,Wright,https://covers.zlibcdn2.com/covers100/books/c5/7e/27/c57e27b8875e827e69787c31a032443a.jpg,Unknown,https://1lib.in/dl/2572527/4ad5dd,396,CRC Press,2012,english,"PDF, 30.22 MB"
"Signal Analysis: Wavelets, Filter Banks, Time-Frequency Transforms and Applications",Alfred Mertins,https://covers.zlibcdn2.com/covers100/books/aa/4e/09/aa4e0966bf1c6277e2dbab4b061662ba.jpg,"
                    Signal Analysis explores methods that offer an insight into the properties of signals and stochastic processes. This comprehensive and authoritative book provides an introduction to the fundamental theory of signal analysis. It bridges the gap between the basic knowledge in system theory and the specialist knowledge in various fields of signal processing and provides a complete overview of current applications. Features include:Focus on both classical and modern approaches to transforms, such as the KarhunenвЂ”LoГЁve transform and the discrete Fourier transformEnhancement of the understanding and relation of transform theoryDiscussion of recent and emerging topics, including filter banks with perfect reconstruction time-frequency and wavelets.With its great accuracy and technical merit, Signal Analysis is essential reading for signal processing engineers, researchers, undergraduates, postgraduates and lecturers of electrical and computer engineering.                ",https://1lib.in/dl/611162/769776,327,Wiley,1999,english,"PDF, 12.01 MB"
Real-time digital signal processing based on the TMS320C6000,Nasser Kehtarnavaz,https://covers.zlibcdn2.com/covers100/books/56/8f/a2/568fa2982054b83c778e246292b7af97.jpg,"
                    Texas Instruments has introduced the TMS320C6000 DSP processor family to meet the high performance demands of today's signal processing applications. This book provides the know-how for the implementation and optimization of computationally intensive signal processing algorithms on the Texas Instruments family of TMS320C6000 DSP processors. It is organized in such a way that it can be used as the textbook for DSP lab courses offered at many engineering schools or as a self-study/reference for those familiar with DSP, but not this family of processors. This book provides a restructured, modified, and condensed version of the information in more than twenty TI manuals so that one can learn real-time DSP implementations on the C6000 family in a structured course, within one semester. Eight lab exercises, together with four project examples are discussed and included on the accompanying CD to take the reader through the entire process of C6X code writing.                ",https://1lib.in/dl/496239/e8028a,321,Elsevier; Newnes,2005,english,"PDF, 11.21 MB"
"Four Short Courses on Harmonic Analysis: Wavelets, Frames, Time-Frequency Methods, and Applications to Signal and Image Analysis",Peter Massopust,https://covers.zlibcdn2.com/covers100/books/df/75/8a/df758adf618465f0afa11f93e054d1ba.jpg,"
This state-of-the-art textbook examines four research directions in harmonic analysis and features some of the latest applications in the field, including cosmic microwave background analysis, human cortex image denoising, and wireless communication. The work is the first one that combines spline theory (from a numerical or approximation-theoretical view), wavelets, frames, and time-frequency methods leading up to a construction of wavelets on manifolds other than Rn.Written by internationally renowned mathematicians, the interdisciplinary chapters are expository by design, enabling the reader to understand the theory behind modern image and signal processing methodologies. The main emphasis throughout the book is on the interdependence of the four modern research directions covered. Each chapter ends with exercises that allow for a more in-depth understanding of the material and are intended to stimulate the reader toward further research. A comprehensive index completes the work.Topics covered:* Frames and bases in mathematics and engineering* Wavelets with composite dilations and their applications* Wavelets on the sphere and their applications* Wiener's Lemma: theme and variationsFour Short Courses on Harmonic Analysis is intended as a graduate-level textbook for courses or seminars on harmonic analysis and its applications. The work is also an excellent reference or self-study guide for researchers and practitioners with diverse mathematical backgrounds working in different fields such as pure and applied mathematics, image and signal processing engineering, mathematical physics, and communication theory. ",https://1lib.in/dl/659937/9d8d0a,249,Birkhäuser Basel,2010,english,"PDF, 8.27 MB"
Discrete-Time Signal Processing,Buck J. R.,https://covers.zlibcdn2.com/covers100/books/fa/0b/d4/fa0bd402f8967bd4b158d406d975dada.jpg,"
                    Discrete-time signal processing continues to be a dynamic and rapidly growing field with a wide range of applications including speech and data communication, acoustics, radar, sonar, seismology, remote sensing, instrumentation, consumer electronics, and many others. Discrete-time Signal Processing, by the authors of the classic text Digital Signal Processing (Prentice Hall, 1975), is a completely up-to-date, thorough, and coherent treatment of the fundamentals of this field. Considerable emphasis is placed on illustrative examples and intuitive interpretation. The authors include more than 400 carefully prepared problems to help the reader develop a thorough foundation in the use of this material.                ",https://1lib.in/dl/493550/360fb3,870,Unknown,1998,english,"RAR, 7.19 MB"
"Potential Rapid Diagnostics, Vaccine and Therapeutics for 2019 Novel Coronavirus (2019-nCoV): A Systematic Review",Junxiong Pang,https://covers.zlibcdn2.com/covers100/books/b1/0b/cd/b10bcd69cbba0c383b63f0481cdeffe4.jpg,Unknown,https://1lib.in/dl/5358709/3b6266,30,MDPI,2020,english,"PDF, 901 KB"
Crohn's Disease and Ulcerative Colitis: From Epidemiology and Immunobiology to a Rational Diagnostic and Therapeutic Approach,Daniel C. Baumgart (eds.),https://covers.zlibcdn2.com/covers100/books/d3/0f/bc/d30fbc1b27e4418275bfcc00a8f67198.jpg,"
This new edition is a unique combined resource for physicians and scientists addressing the needs of both groups. In addition to stimulating exchange and collaboration and shortening the path between discovery and application of new knowledge, the book helps clinicians understand new therapeutic concepts from their origins. The volume serves as a comprehensive guide to the current diagnostic modalities, including enhanced imaging techniques such as MRI and CT enterography, virtual colonoscopy, ultrasound, and endomicroscopy, as well as conventional and complex immunomodulatory principles. The latest edition also includes revised chapters from the previous edition, as well as new chapters reflecting current developments in the field. Written by experts in their field, Crohn’s Disease and Ulcerative Colitis: From Epidemiology and Immunobiology to a Rational Diagnostic and Therapeutic Approach, Second Edition is of great value to gastroenterologists, surgeons, internists, pediatricians and gynecologists trainees, as well as all those involved in Crohn’s disease, ulcerative colitis, and related autoimmune disorders. ",https://1lib.in/dl/2940608/9a9db6,671,Springer International Publishing,2017,english,"PDF, 32.12 MB"
Atlas of Confocal Laser Scanning In-vivo Microscopy in Opthalmology - Principles and Applications in Diagnostic and Therapeutic Ophtalmology,Guthoff R.F.,https://covers.zlibcdn2.com/covers100/books/c0/e2/c1/c0e2c128eda2275a2c6e19869895a570.jpg,"
                    This atlas and textbook summarizes our experi-ence in the rather new field of clinical in vivo.micromorphology. Stimulated by the work of Maurice, Jester, Bourne, Beuermann, Masters, Mathers, Thaer and others, our long-lasting cooperation is based on the mutual interest to push forward the frontiers of biomicroscopy using and combining recently available technical principles such as laser scanning, fast digital signal capture and processing and techniques for image stabilization. As a prerequisite there was the Heidelberg Retina Tomograph system.for optic disc analysis with more than 5000 users worldwide and the engineering skill and.dedication of physicists and engineers carefully listened to the wishes and dreams of the clinicians. So we are already on the way to in vivo biopsy, as postulated by Teruo Nishida.The content of the book reflects the common efforts of clinicians and physicists from the Rostock University Eye Department and the Centre Hospitalier National d’Ophtalmologie des Quinze-Vingts in Paris. Both groups share the enthusiasm to incorporate in vivo microscopy in the clinical decision making process by imag-ing, measuring and quantifying tissue parameters to achieve a quick and exact diagnosis and to monitor treatment in order to find the optimal path for patient recovery..Contents:.Introduction.Principles of Confocal In Vivo Microscopy.General Anatomical Considerations.Ex Vivo Applications.Confocal Laser Scanning In Vivo Microscopy.Promising Applications.Nonophthalmological Applications.Confocal In Vivo Microscopy in Animal Experiments.Current and Future Development.References.Subject Index.                ",https://1lib.in/dl/2992002/afc349,Unknown,Springer,2006,english,"PDF, 16.86 MB"
Diagnostic and Therapeutic Nuclear Medicine for Neuroendocrine Tumors,Karel Pacak,https://covers.zlibcdn2.com/covers100/books/7f/66/aa/7f66aa0560b46edfc8a66c3c01ab868e.jpg,"
Based on the most novel approaches and cutting-edge clinical and scientific information regarding radionuclide imaging and therapies for neuroendocrine tumors, this clinical guidebook represents a unique collaborative effort between endocrinologists, nuclear physicians, oncologists, surgeons, physicists, radio-pharmacists and geneticists. It begins with the embryology, classification and molecular genetics of gastroenteropancreatic neuroendocrine tumors and carcinoids, chromaffin cell tumors, and MEN1- and MEN2-related tumors. Following a chapter on radiopharmaceuticals in neuroendocrine imaging, it turns to the physics and technology of current and cutting-edge radiology, including SPECT/CT and PET/CT and PET/MR. Discussing of radionuclide imaging covers the tumors mentioned above, as well as pulmonary and thymic neuroendocrine tumors and medullary thyroid carcinoma. A presentation of radionuclide therapies follows, including 131I-MIBG therapy, somatostatin receptor-based therapy, and alpha radionuclide therapy, as well as the role of nanoparticles.Comprehensive and up-to-date, Diagnostic and Therapeutic Nuclear Medicine for Neuroendocrine Tumors will assist and guide physicians who encounter patients with these conditions, either from a diagnostic or therapeutic standpoint, and particularly emphasizes the current and emerging medical devices and imaging and therapeutic options. ",https://1lib.in/dl/2868367/1eb59e,483,Humana Press,2017,english,"PDF, 14.13 MB"
Diagnostic and Therapeutic Antibodies ,Andrew J.T. George,https://covers.zlibcdn2.com/covers100/books/1a/67/08/1a67083af6196923273f4f33e59ed5cf.jpg,"
                    A team of experts comprehensively review the theoretical and practical aspects of applying antibodies in both the laboratory and clinic. For general understanding, the book thoroughly introduces the basic science of the antibody molecule, including recombinant engineering. Several novel in vivo applications of therapeutic antibodies are then presented to illustrate their special value in varied clinical settings. For those new to the field, there are readily reproducible methods for generating and purifying antibodies and for modifying them for clinical application. Timely and comprehensive, Diagnostic and Therapeutic Antibodies offers today's researchers a concise introduction to the field, as well as a highly useful compendium of practical protocols that will greatly facilitate the application of these powerful new diagnostic and therapeutic agents.                ",https://1lib.in/dl/461050/a06d7c,452,Humana Press,2000,english,"PDF, 2.54 MB"
Diagnostic and Therapeutic Applications of Exosomes in Cancer,Mansoor Amiji,https://covers.zlibcdn2.com/covers100/books/00/d9/8a/00d98a21cef6be58ede5a850e0fe8f6c.jpg,Unknown,https://1lib.in/dl/5356056/420ada,Unknown,Unknown,Unknown,english,"PDF, 13.49 MB"
