title,author,image,desc,download_link,pages,publisher,year,language,file
Geotechnical Engineering: Principles and Practices of Soil Mechanics and Foundation Engineering (Civil and Environmental Engineering),V.N.S. Murthy,https://covers.zlibcdn2.com/covers100/books/92/40/cc/9240cc3fe245792d68b807cc15df9c29.jpg,"
                    A must have reference for any engineer involved with foundations, piers, and retaining walls, this remarkably comprehensive volume illustrates soil characteristic concepts with examples that detail a wealth of practical considerations, It covers the latest developments in the design of drilled pier foundations and mechanically stabilized earth retaining wall and explores a pioneering approach for predicting the nonlinear behavior of laterally loaded long vertical and batter piles.   As complete and authoritative as any volume on the subject, it discusses soil formation, index properties, and classification; soil permeability, seepage, and the effect of water on stress conditions; stresses due to surface loads; soil compressibility and consolidation; and shear strength characteristics of soils.   While this book is a valuable teaching text for advanced students, it is one that the practicing engineer will continually be taking off the shelf long after school lets out. Just the quick reference it affords to a huge range of tests and the appendices filled with essential data, makes it an essential addition to an civil engineering library.                ",https://1lib.in/dl/1064021/76a118,1048,CRC Press,2002,english,"PDF, 31.86 MB"
"Information Security: Foundations, technologies and applications",Ali Ismail Awad,https://covers.zlibcdn2.com/covers100/books/c5/07/0f/c5070fbe0c0199b1a28d0d3f33f65d0b.jpg,"
                    The rapid advancements in telecommunications, computing hardware and software, and data encryption, and the widespread use of electronic data processing and electronic business conducted through the Internet have led to a strong increase in information security threats. The latest advances in information security have increased practical deployments and scalability across a wide range of applications to better secure and protect our information systems and the information stored, processed and transmitted. This book outlines key emerging trends in information security from the foundations and technologies in biometrics, cybersecurity, and big data security to applications in hardware and embedded systems security, computer forensics, the Internet of Things security, and network security. Information Security: Foundations, technologies and applications is a comprehensive review of cutting-edge algorithms, technologies, and applications, and provides new insights into a range of fundamentally important topics in the field. This up-to-date body of knowledge is essential reading for researchers and advanced students in information security, and for professionals in sectors where information security is required                ",https://1lib.in/dl/3614443/6c187f,Unknown,Institution of Engineering & Technology,2018,english,"PDF, 25.54 MB"
"Geotechnical Engineering: Soil and Foundation Principles and Practice, 5th Ed.",Richard Handy,https://covers.zlibcdn2.com/covers100/books/db/72/84/db7284a32981fa214fa27bae162642fe.jpg,"
Master the Latest Developments in Soil Testing and  New Applications of Geotechnical Engineering Geotechnical Engineering: Principles and Practices offers students and practicing engineers a concise, easy-to-understand approach to the principles and methods of soil and geotechnical engineering. This updated classic builds from basic principles of soil mechanics and applies them to new topics, including mechanically stabilized earth (MSE), and intermediate foundations. This Fifth Edition features: Over 400 detailed illustrations and photographs Unique background material on the geological, pedological, and  mineralogical aspects of soils with emphasis on clay mineralogy, soil structure, and expansive and collapsible soils. New coverage of mechanically stabilized earth (MSE); intermediate foundations; in-situ soil testing: statistical analysis of data; “FORE,” a scientific method for analyzing settlement; writing the geotechnical report; and the geotechnical engineer as a sleuth and expert witness. Get Quick Access to Every Soil and Geotechnical Engineering Topic • Igneous Rocks as Ultimate Sources for Soils • The Soil Profile • Soil Minerals • Particle Size and Gradation • Soil Fabric and Soil Structure • Soil Density and Unit Weight • Soil Water • Soil Consistency and Engineering Classification • Compaction • Seepage • Stress Distribution • Settlement • Shear Strength • Lateral Stress and Retaining Walls • MSE Walls and Soil Nailing • Slope Stability, Landslides, Embankments, and Earth Dams • Bearing Capacity of Shallow Foundations • Deep Foundations • Intermediate Foundations • Loads on Pipes • In-Situ Testing • Introduction to Soil Dynamics • The Geotechnical Report                ",https://1lib.in/dl/2574630/e2bc3d,904,McGraw-Hill Education,2007,english,"PDF, 16.49 MB"
Principles of Foundation Engineering,Braja M. Das,https://covers.zlibcdn2.com/covers100/books/b3/a2/95/b3a2956f2e33acd83c7926f4122391db.jpg,"
                    Master the fundamental concepts and applications of foundation analysis design with PRINCIPLES OF FOUNDATION ENGINEERING. This market leading text maintains a careful balance of current research and practical field applications, offers a wealth of worked out examples and figures that show you how to do the work you will be doing as a civil engineer, and helps you develop the judgment you’ll need to properly apply theories and analysis to the evaluation of soils and foundation design.                ",https://1lib.in/dl/2567102/64f693,946,Cengage Learning,2016,english,"PDF, 40.54 MB"
Advanced Foundation Engineering: Geotechnical Engineering Series,V N S Murthy,https://covers.zlibcdn2.com/covers100/books/b4/da/84/b4da84eebe76008fe6c1d5b37483049f.jpg,"
                    Advanced Foundation Engineering is the second volume in the series on geotechnical engineering, closely following A Textbook of Soil Mechanics and Foundation Engineering written to meet the requirements of undergraduate students. This volume covers various aspects of foundation engineering, bringing together all the relevant advanced theories coherently. As foundations have to be designed to simulate field conditions, it is imperative that the consulting engineer must be conversant with all the theories that are available as also the available approaches. This volume strives to meet most of these requirements  It also presents in detail author s own research work on laterally loaded pile foundations to solve many of the problems confronted in this field. The approach is direct and simple as compared to the complicated methods proposed by others.  This is an excellent text reference for the postgraduate students, practising engineers, consultants, researchers and professionals, in addition to serving as a valuable resource for the candidates appearing in Graduate Aptitude Test for Engineers (GATE), UPSC and other national selection entrance tests/examinations.    1 introduction. 2 shallow foundaion 1,2,3,4, 3 deep foundation                ",https://1lib.in/dl/926317/25f15c,795,CBS Publishers & Distributors,2007,english,"PDF, 34.39 MB"
"Principles of Foundation Engineering, 9th Edition, SI Edition",Braja M. Das & Nagaratnam Sivakugan,https://covers.zlibcdn2.com/covers100/books/11/67/b4/1167b4559eaeb5136c0974014942e493.jpg,Unknown,https://1lib.in/dl/5424579/158c0e,Unknown,"Cengage Learning, Inc.",2019,english,"PDF, 97.05 MB"
Beginning Unreal Game Development: Foundation for Simple to Complex Games Using Unreal Engine 4,David Nixon [David Nixon],https://covers.zlibcdn2.com/covers100/books/82/b8/d3/82b8d3123834ad8017c0dfedfa473b61.jpg,"
Get started creating video games using Unreal Engine 4 (UE4) and learning the fundamentals of game development. Through hands-on, step-by-step tutorials, you will learn to design engaging environments and a build solid foundation for more complex games. Discover how to utilize the 3D game design software behind the development of immensely popular games for PC, console, and mobile. Beginning Unreal Game Development steers you through the fundamentals of game development with UE4 to design environments that both engage the player and are aesthetically pleasing. Author David Nixon shows you how to script logic, define behaviors, store data, and create characters. You will learn to create user interfaces, such as menus, load screens, and head-up displays (HUDs), and manipulate audio to add music, sound effects, and dialogue to your game. The book covers level editors, actor types, blueprints, character creation and control, and much more. Throughout the book, you’ll put theory into practice and create an actual game using a series of step-by-step tutorials. With a clear, step-by-step approach, Beginning Unreal Game Development builds up your knowledge of Unreal Engine 4 so you can start creating and deploying your own 3D video games in no time.What You Will LearnLearn the fundamentals of game designUnderstand how to use Unreal Engine 4Design amazing levels for your characters to play inScript logic to control the behavior of the world you create Who This Book Is ForThis book is for beginners with no prior game design or programming experience. It is also intended for video game enthusiasts who are brand-new to the world of game development and want to learn how to design a game from scratch using UE4. ",https://1lib.in/dl/5545372/6f2b93,389,Apress,2020,english,"EPUB, 19.25 MB"
Foundation Analysis and Design    ,Joseph E. Bowles,https://covers.zlibcdn2.com/covers100/books/d4/cb/43/d4cb43ce2cc733c26012ef9d10f45cb5.jpg,"
                    The revision of this best-selling text for a junior/senior course in Foundation Analysis and Design now includes an IBM computer disk containing 16 compiled programs together with the data sets used to produce the output sheets, as well as new material on sloping ground, pile and pile group analysis, and procedures for an improved anlysis of lateral piles. Bearing capacity analysis has been substantially revised for footings with horizontal as well as vertical loads. Footing design for overturning now incorporates the use of the same uniform linear pressure concept used in ascertaining the bearing capacity. Increased emphasis is placed on geotextiles for retaining walls and soil nailing.                ",https://1lib.in/dl/1225179/f10d2d,1230,McGraw-Hill Science/Engineering/Math,1995,english,"PDF, 57.24 MB"
Foundations of Game Engine Development Volume 2 Rendering,Eric Lengyel,https://covers.zlibcdn2.com/covers100/books/0f/e6/bb/0fe6bb798913429afbf006c57fc8268a.jpg,"
                    ""This second volume in the Foundations of Game Engine Development series explores the vast subject of real-time rendering in modern game engines. The book provides a detailed introduction to color science, world structure, projections, shaders, lighting, shadows, fog, and visibility methods. This is followed by extensive discussions of a variety of advanced rendering techniques that include volumetric effects, atmospheric shadowing, ambient occlusion, motion blur, and isosurface extraction. Emphasis is placed on practical implementation, and code is included.""

Amazon description                ",https://1lib.in/dl/5558305/312c6b,409,Terathon Software,2019,english,"PDF, 20.94 MB"
"Engineering Mathematics. A Foundation for Electronic, Electrical, Communications and Systems Engineers",Anthony Croft,https://covers.zlibcdn2.com/covers100/books/e9/b8/20/e9b820f264757c45b1dcd088a562ae04.jpg,Unknown,https://1lib.in/dl/2936956/1996ed,1017,Pearson,2017,english,"PDF, 5.50 MB"
Foundations of Materials Science and Engineering,Willaim Smith,https://covers.zlibcdn2.com/covers100/books/4d/09/ff/4d09ffe28b57104ac1436075f8ff723c.jpg,Unknown,https://1lib.in/dl/5499351/e5b605,Unknown,McGraw-Hill Education,2019,english,"PDF, 60.63 MB"
"Failure Case Studies in Civil Engineering: Structures, Foundations, and the Geoenvironment",Paul A. Bosela,https://covers.zlibcdn2.com/covers100/books/b5/bb/a4/b5bba4a8c5447e666b85f9a63198c131.jpg,"
                    Failure Case Studies in Civil Engineering: Structures, Foundations, and the Geoenvironment, Second Edition, provides short descriptions of 50 real-world examples of constructed works that did not perform as intended. Designed for classroom use, each case study contains a brief summary, lessons learned, and references to key sources. This new edition, which replaces the 1995 classic edited by Robin Shepherd and J. David Frost, offers expanded descriptions, additional photographs and diagrams, and updated references. It also includes new case studies, such as the Alfred P. Murrah Federal Building, the Charles de Gaulle Airport Terminal, and the North Battleford, Saskatchewan, Water Treatment Plant. Topics include: foundation failures; embankment, dam, and slope failures; geoenvironmental failures; bridge failures; and building failures. This book supplies valuable resource material on typical failures that can be integrated into undergraduate engineering courses. Engineering professors and their students will use this book as the basis for class discussions, a starting point for further research, and a demonstration of how each failure leads to improved engineering design and safety.                ",https://1lib.in/dl/2460115/cd360f,126,Amer Society of Civil Engineers,2012,english,"PDF, 3.88 MB"
Requirements Engineering Fundamentals: A Study Guide for the Certified Professional for Requirements Engineering Exam - Foundation Level - IREB compliant,Klaus Pohl,https://covers.zlibcdn2.com/covers100/books/5a/2d/ba/5a2dba655cfc54a1d782734fa3780ee7.jpg,"
Requirements engineering tasks have become increasingly complex. In order to ensure a high level of knowledge and competency among requirements engineers, the International Requirements Engineering Board (IREB) developed a standardized qualification called the Certified Professional for Requirements Engineering (CPRE). The certification defines the practical skills of a requirements engineer on various training levels.This book is designed for self-study and covers the curriculum for the Certified Professional for Requirements Engineering Foundation Level exam as defined by the IREB.The 2nd edition has been thoroughly revised and is aligned with the curriculum Version 2.2 of the IREB. In addition, some minor corrections to the 1st edition have been included.About IREB:The mission of the IREB is to contribute to the standardization of further education in the fields of business analysis and requirements engineering by providing syllabi and examinations, thereby achieving a higher level of applied requirements engineering. The IRE Board is comprised of a balanced mix of independent, internationally recognized experts in the fields of economy, consulting, research, and science. The IREB is a non-profit corporation. For more information visit www.certified-re.com. ",https://1lib.in/dl/2603456/e6c937,184,Rocky Nook,2015,english,"PDF, 4.26 MB"
Play with Graphs for RMO INMO IIT JEE Foundation main Advanced Essential Coaching Engineering Entrance Exams IITJEE Examination Amit Agarwal Arihant ISBN 9788188222230,Amit Agarwal Arihant,https://covers.zlibcdn2.com/covers100/books/07/1a/6d/071a6dcfc1f963acaba04546e021c2b5.jpg,"
                    Play with Graphs for RMO INMO IIT JEE Foundation main Advanced Essential Coaching Engineering Entrance Exams IITJEE Examination Amit  Agarwal Arihant ISBN 9788188222230                ",https://1lib.in/dl/5208673/f091dd,188,Arihant,2019,english,"PDF, 33.45 MB"
Bridgecourse Physics Arihant for self study after class 10 Boards Part 1 upto page 267 by Vikas Jain IIT JEE Engineering Medical Foundation KVPY Olympiad,Vikas Jain,https://covers.zlibcdn2.com/covers100/books/a3/d3/59/a3d35983960bd12a54b7c73d88708149.jpg,"
                    Bridgecourse Physics Arihant for self study after class 10 Boards Part 1 upto page 267 by Vikas Jain IIT JEE Engineering Medical Foundation KVPY Olympiad                ",https://1lib.in/dl/3602376/e526b0,272,Arihant,2018,english,"PDF, 71.55 MB"
Foundations of materials science and engineering,William Smith,https://covers.zlibcdn2.com/covers100/books/98/c3/e8/98c3e864870adac1c54181f4aae21c91.jpg,Unknown,https://1lib.in/dl/5277620/de519d,Unknown,Unknown,Unknown,Unknown,"PDF, 65.53 MB"
"Concrete Foundations for Turbine Generators: Analysis, Design, and Construction",Task Committee on Turbine Generator Foundations,https://covers.zlibcdn2.com/covers100/books/ec/15/68/ec1568f8bbbfb340650be22769a15701.jpg,"
The design of turbine-generator foundations requires advanced technical expertise in structural engineering and soil dynamics, as well as close collaboration with manufacturers, mechanical and electrical engineers, and plant designers. Various manufacturers have different requirements for such foundations, and application of code provisions can demand a significant degree of interpretation. Concrete Foundations for Turbine Generators: Analysis, Design, and Construction provides the practical assistance needed by structural engineers and facility owners to meet these challenges with the most up-to-date and reliable information available. This Manual of Practice addresses the design of three types of concrete foundations for turbine generators: block foundations, with pedestals, piers, and blocks supported on a common mat foundation (basemat); elevated space-frame pedestal foundations, with columns, walls, and a tabletop supported on the basemat; and foundations where equipment or structural elements are supported on a vibration-isolation system. Topics include turbine generator equipment, foundation layout and sizing, foundation loads and load combinations, modeling of soil and pile response to dynamic loads, finite element modeling, serviceability analysis and acceptance criteria, strength and stability design, embedded items, vibration-isolated foundations, and construction considerations. Three appendixes on dynamic impedance discuss soil-supported rigid foundations, pile-supported foundations, and calculation examples.  ",https://1lib.in/dl/3520841/376e5a,246,Amer Society of Civil Engineers,2018,english,"PDF, 9.06 MB"
"Data Analysis From Scratch With Python: Beginner Guide using Python, Pandas, NumPy, Scikit-Learn, IPython, TensorFlow and Matplotlib",Peters Morgan,https://covers.zlibcdn2.com/covers100/books/a5/10/8a/a5108afa8391afc1d92bf3dcac1d8a35.jpg,"
                    ***** BUY NOW (Will soon return to 25.59) ******Free eBook for customers who purchase the print book from Amazon****** Are you thinking of becoming a data analyst using Python? If you are looking for a complete guide to data analysis using Python language and its library that will help you to become an effective data scientist, this book is for you. From AI Sciences Publisher Our books may be the best one for beginners; it's a step-by-step guide for any person who wants to start learning Artificial Intelligence and Data Science from scratch. It will help you in preparing a solid foundation and learn any other high-level courses. To get the most out of the concepts that would be covered, readers are advised to adopt hands on approach, which would lead to better mental representations. Step By Step Guide and Visual Illustrations and Examples The Book give complete instructions for manipulating, processing, cleaning, modeling and crunching datasets in Python. This is a hands-on guide with practical case studies of data analysis problems effectively. You will learn pandas, NumPy, IPython, and Jupiter in the Process. Target Users This book is a practical introduction to data science tools in Python. It is ideal for analyst's beginners to Python and for Python programmers new to data science and computer science. Instead of tough math formulas, this book contains several graphs and images. What's Inside This Book?IntroductionWhy Choose Python for Data Science & Machine LearningPrerequisites & RemindersPython Quick ReviewOverview & ObjectivesA Quick ExampleGetting & Processing DataData VisualizationSupervised & Unsupervised LearningRegressionSimple Linear RegressionMultiple Linear RegressionDecision TreeRandom ForestClassificationLogistic RegressionK-Nearest NeighborsDecision Tree ClassificationRandom Forest ClassificationClusteringGoals & Uses of ClusteringK-Means ClusteringAnomaly DetectionAssociation Rule LearningExplanationAprioriReinforcement LearningWhat is Reinforcement LearningComparison with Supervised & Unsupervised LearningApplying Reinforcement LearningNeural NetworksAn Idea of How the Brain WorksPotential & ConstraintsHere's an ExampleNatural Language ProcessingAnalyzing Words & SentimentsUsing NLTKModel Selection & Improving PerformanceSources & ReferencesFrequently Asked QuestionsQ: Is this book for me and do I need programming experience? A: if you want to smash Python for data analysis, this book is for you. Little programming experience is required. If you already wrote a few lines of code and recognize basic programming statements, you'll be OK.Q: Does this book include everything I need to become a data science expert? A: Unfortunately, no. This book is designed for readers taking their first steps in data analysis and further learning will be required beyond this book to master all aspects.Q: Can I have a refund if this book is not fitted for me? A: Yes, Amazon refund you if you aren't satisfied, for more information about the amazon refund service please go to the amazon help platform. We will also be happy to help you if you send us an email at contact@aisciences.net.AI Sciences Company offers you a free eBooks at http: //aisciences.net/free/                ",https://1lib.in/dl/4984913/d1c1c8,153,AI Sciences LLC,2018,english,"PDF, 2.79 MB"
"Data Structures and Algorithm Analysis in C++, 3rd Edition  ",Dr. Clifford A. Shaffer,https://covers.zlibcdn2.com/covers100/books/7e/a3/c3/7ea3c39173f146f675b63b146d1535f3.jpg,"
                    A comprehensive treatment focusing on the creation of efficient data structures and algorithms, this text explains how to select or design the data structure best suited to specific problems. It uses C++ as the programming language and is suitable for second-year data structure courses and computer science courses in algorithmic analysis.                ",https://1lib.in/dl/1192132/abc3cf,613,Dover Publications,2011,english,"PDF, 2.67 MB"
"The Art and Science of Technical Analysis: Market Structure, Price Action, and Trading Strategies",Adam Grimes,https://covers.zlibcdn2.com/covers100/books/fd/91/b1/fd91b1ab43d9cd643a11591c807a27e8.jpg,Unknown,https://1lib.in/dl/3501589/dbb089,480,Wiley,2012,english,"EPUB, 6.87 MB"
Elementary Structural Analysis and Design of Buildings: A Guide for Practicing Engineers and Students,Dominick R. Pilla,https://covers.zlibcdn2.com/covers100/books/6b/4c/b3/6b4cb3c2ab1cbf3d136415db62e50f93.jpg,"
This overview of the analysis and design of buildings runs from basic principles and elementary structural analysis to the selection of structural systems and materials, and on to foundations and retaining structures. It presents a variety of approaches and methodologies while featuring realistic design examples.   As a comprehensive guide and desk reference for practicing structural and civil engineers, and for engineering students, it draws on the author’s teaching experience at The City College of New York and his work as a design engineer and architect. It is especially useful for those taking the National Council of Examiners for Engineering and Surveying SE exam. ",https://1lib.in/dl/3499252/715ccc,271,CRC Press,2016,english,"PDF, 11.18 MB"
