title,author,image,desc,download_link,pages,publisher,year,language,file
"Design, Evaluation, and Analysis of Questionnaires for Survey Research",Willem E. Saris,https://covers.zlibcdn2.com/covers100/books/45/9a/c2/459ac276f0f0455ec75ded1c5a537de6.jpg,"
                    Praise for the  First Edition ""...this book is quite inspiring, giving many practical ideas for survey research, especially for designing better questionnaires."" --International Statistical Review Reflecting modern developments in the field of survey research, the  Second Edition  of  Design, Evaluation, and Analysis of Questionnaires for Survey Research  continues to provide cutting-edge analysis of the important decisions researchers make throughout the survey design process.  The new edition covers the essential methodologies and statistical tools utilized to create reliable and accurate survey questionnaires, which unveils the relationship between individual question characteristics and overall question quality. Since the  First Edition , the computer program Survey Quality Prediction (SQP) has been updated to include new predictions of the quality of survey questions on the basis of analyses of Multi-Trait Multi-Method experiments. The improved program contains over 60,000 questions, with translations in most European languages. Featuring an expanded explanation of the usage and limitations of SQP 2.0 , the  Second Edition  also includes:  * New practice problems to provide readers with real-world experience in survey research and questionnaire design  * A comprehensive outline of the steps for creating and testing survey questionnaires  * Contemporary examples that demonstrate the many pitfalls of questionnaire design and ways to avoid similar decisions Design, Evaluation, and Analysis of Questionnaires for Survey Research, Second Edition  is an excellent textbook for upper-undergraduate and graduate-level courses in methodology and research questionnaire planning, as well as an ideal resource for social scientists or survey researchers needing to design, evaluate, and analyze questionnaires. Design, Evaluation, and Analysis of Questionnaires for Survey Research, Second Edition  is an excellent textbook for upper-undergraduate and graduate-level courses in methodology and research questionnaire planning, as well as an ideal resource for social scientists or survey researchers needing to design, evaluate, and analyze questionnaires.Reflecting modern developments in the field of survey research, the Second Edition of  Design, Evaluation, and Analysis of Questionnaires for Survey Research continues to  provide cutting-edge analysis of the important decisions researchers make throughout the  survey design process. The new edition covers the essential methodologies and statistical tools utilized to create  reliable and accurate survey questionnaires, which unveils the relationship between individual  question characteristics and overall question quality. Since the First Edition, the computer  program Survey Quality Prediction (SQP) has been updated to include new predictions  of the quality of survey questions on the basis of analyses of Multi-Trait Multi-Method  experiments. The improved program contains over 60,000 questions, with translations in  most European languages. Featuring an expanded explanation of the usage and limitations of  SQP 2.0 , the Second Edition also includes:  * New practice problems to provide readers with real-world experience in survey  research and questionnaire design  * A comprehensive outline of the steps for creating and testing survey questionnaires  * Contemporary examples that demonstrate the many pitfalls of questionnaire design and  ways to avoid similar decisions  Design, Evaluation, and Analysis of Questionnaires for Survey Research, Second Edition is an  excellent textbook for upper-undergraduate and graduate-level courses in methodology and  research questionnaire planning, as well as an ideal resource for social scientists or survey  researchers needing to design, evaluate, and analyze questionnaires.  WILLEM E. SARIS, PhD, is Emeritus Professor in Methodology of the University of Amsterdam  and the Universitat Pompeu Fabra, Barcelona. He is Laureate of the 2005 Descartes Prize for  ""Best Collaborative Research"" as member of the Central Coordinating Team of the European  Social Survey (ESS) and Recipient of the World Association of Public Opinion Research's  ""Helen Dinerman Award"" in 2009 for his lifelong contribution to the methodology of Opinion  Research. Dr. Saris also received the ""2013 Outstanding Service Prize"" of the European  Survey Research Association.  IRMTRAUD N. GALLHOFER, PhD, is a linguist and was senior researcher on projects of  the ESS, Research and Expertise Centre for Survey Methodology at the Universitat Pompeu  Fabra, Barcelona. She is Laureate of the 2005 Descartes Prize for ""Best Collaborative Research""  as a member of the Central Coordinating Team of the ESS.Reflecting modern developments in the field of survey research, the Second Edition of  Design, Evaluation, and Analysis of Questionnaires for Survey Research continues to  provide cutting-edge analysis of the important decisions researchers make throughout the  survey design process.  The new edition covers the essential methodologies and statistical tools utilized to create  reliable and accurate survey questionnaires, which unveils the relationship between individual  question characteristics and overall question quality. Since the First Edition, the computer  program Survey Quality Prediction (SQP) has been updated to include new predictions  of the quality of survey questions on the basis of analyses of Multi-Trait Multi-Method  experiments. The improved program contains over 60,000 questions, with translations in  most European languages. Featuring an expanded explanation of the usage and limitations of  SQP 2.0, the Second Edition also includes:  * New practice problems to provide readers with real-world experience in survey  research and questionnaire design  * A comprehensive outline of the steps for creating and testing survey questionnaires  * Contemporary examples that demonstrate the many pitfalls of questionnaire design and  ways to avoid similar decisions  Design, Evaluation, and Analysis of Questionnaires for Survey Research, Second Edition is an  excellent textbook for upper-undergraduate and graduate-level courses in methodology and  research questionnaire planning, as well as an ideal resource for social scientists or survey  researchers needing to design, evaluate, and analyze questionnaires.  WILLEM E. SARIS, PhD, is Emeritus Professor in Methodology of the University of Amsterdam  and the Universitat Pompeu Fabra, Barcelona. He is Laureate of the 2005 Descartes Prize for  ""Best Collaborative Research"" as member of the Central Coordinating Team of the European  Social Survey (ESS) and Recipient of the World Association of Public Opinion Research's  ""Helen Dinerman Award"" in 2009 for his lifelong contribution to the methodology of Opinion  Research. Dr. Saris also received the ""2013 Outstanding Service Prize"" of the European  Survey Research Association.  IRMTRAUD N. GALLHOFER, PhD, is a linguist and was senior researcher on projects of  the ESS, Research and Expertise Centre for Survey Methodology at the Universitat Pompeu  Fabra, Barcelona. She is Laureate of the 2005 Descartes Prize for ""Best Collaborative Research""  as a member of the Central Coordinating Team of the ESS                ",https://1lib.in/dl/2488656/d07c2d,376,Wiley,2014,english,"PDF, 2.58 MB"
"Datums and Map Projections: For Remote Sensing, GIS and Surveying",Jonathan C. Iliffe,https://covers.zlibcdn2.com/covers100/books/ff/a4/50/ffa4502ee59230b261ea86aecd27494a.jpg,Unknown,https://1lib.in/dl/865105/ea323a,160,Whittles Publishing,2000,english,"PDF, 6.77 MB"
"Introducing the New Testament: A Historical, Literary, and Theological Survey",Mark Allan Powell,https://covers.zlibcdn2.com/covers100/books/39/ec/03/39ec0312fe1162f9fe8616497dda3396.jpg,"
                    This beautifully written and engaging survey offers an up-to-date New Testament introduction for undergraduate students and general readers. Powell presents disputed and controversial issues fairly, neither dictating conclusions nor privileging skepticism over faith-based perspectives. The book is written in a lively and engaging style and includes helpful sidebars, maps, tables, charts, glossary, diagrams, and suggestions for further reading. In addition, this full-color book includes beautiful artwork illustrating the reception of the New Testament through various times and cultures. A companion Web site will feature a wealth of additional resources for students and instructors.                ",https://1lib.in/dl/2166260/25acb0,560,Baker Academic,2009,english,"PDF, 41.93 MB"
Designing and Conducting Survey Research: A Comprehensive Guide,Louis M. Rea,https://covers.zlibcdn2.com/covers100/books/ff/1a/4f/ff1a4fbc56559b8080f43900e48dacb4.jpg,"
The industry standard guide, updated with new ideas and SPSS analysis techniquesDesigning and Conducting Survey Research: A Comprehensive Guide Fourth Edition is the industry standard resource that covers all major components of the survey process, updated to include new data analysis techniques and SPSS procedures with sample data sets online. The book offers practical, actionable guidance on constructing the instrument, administrating the process, and analyzing and reporting the results, providing extensive examples and worksheets that demonstrate the appropriate use of survey and data techniques. By clarifying complex statistical concepts and modern analysis methods, this guide enables readers to conduct a survey research project from initial focus concept to the final report.Public and nonprofit managers with survey research responsibilities need to stay up-to-date on the latest methods, techniques, and best practices for optimal data collection, analysis, and reporting. Designing and Conducting Survey Research is a complete resource, answering the ""what"", ""why"", and ""how"" every step of the way, and providing the latest information about technological advancements in data analysis. The updated fourth edition contains step-by-step SPSS data entry and analysis procedures, as well as SPSS examples throughout the text, using real data sets from real-world studies. Other new information includes topics like:Nonresponse error/biasEthical concerns and special populationsCell phone samples in telephone surveysSubsample screening and complex skip patternsThe fourth edition also contains new information on the growing importance of focus groups, and places a special emphasis on data quality including size and variability. Those who employ survey research methods will find that Designing and Conducting Survey Research contains all the information needed to better design, conduct, and analyze a more effective survey.                ",https://1lib.in/dl/2371214/9c4a1b,360,Jossey-Bass,2014,english,"PDF, 4.56 MB"
"The Wiley handbook of psychometric testing : a multidisciplinary reference on survey, scale, and test development",Irwing,https://covers.zlibcdn2.com/covers100/books/7a/4d/f0/7a4df0d567fcb8157b6998037a81e593.jpg,"
                    A must-have resource for researchers, practitioners, and advanced students interested or involved in psychometric testing Over the past hundred years, psychometric testing has proved to be a valuable tool for measuring personality, mental ability, attitudes, and much more. The word 'psychometrics' can be translated as 'mental measurement'; however, the implication that psychometrics as a field is confined to psychology is highly misleading. Scientists and practitioners from virtually every conceivable discipline now use and analyze data collected from questionnaires, scales, and tests developed from psychometric principles, and the field is vibrant with new and useful methods and approaches. This handbook brings together contributions from leading psychometricians in a diverse array of fields around the globe. Each provides accessible and practical information about their specialist area in a three-step format covering historical and standard approaches, innovative issues and techniques, and practical guidance on how to apply the methods discussed. Throughout, real-world examples help to illustrate and clarify key aspects of the topics covered. The aim is to fill a gap for information about psychometric testing that is neither too basic nor too technical and specialized, and will enable researchers, practitioners, and graduate students to expand their knowledge and skills in the area.-Provides comprehensive coverage of the field of psychometric testing, from designing a test through writing items to constructing and evaluating scales -Takes a practical approach, addressing real issues faced by practitioners and researchers -Provides basic and accessible mathematical and statistical foundations of all psychometric techniques discussed -Provides example software code to help readers implement the analyses discussed. Read more...  Abstract:                         A must-have resource for researchers, practitioners, and advanced students interested or involved in psychometric testing Over the past hundred years, psychometric testing has proved to be a valuable tool for measuring personality, mental ability, attitudes, and much more. Read more... ",https://1lib.in/dl/3517544/dbd671,Unknown,Wiley,2018,english,"PDF, 9.41 MB"
Encountering the New Testament : a historical and theological survey,Elwell,https://covers.zlibcdn2.com/covers100/books/7e/50/68/7e5068f0d6fed3872dd9404f9809fdfe.jpg,"
                    ""Studying the New Testament can be an exciting-and intimidating-experience. This readable survey is designed to make the adventure less daunting and more rewarding. Two experienced classroom teachers offer a new edition of their bestselling and award-winning textbook, now with updated content and a new interior design. Other distinguishing features include: abundant images, maps, and charts-all in full color; sidebars that address ethical and theological concerns and provide primary source material; focus boxes isolating key issues; chapter outlines, learning objectives, and summaries; study questions. An accompanying website will offer a wide array of resources for students and professors. Resources for students include flash cards, self quizzes, and chapter summaries. Resources for professors include suggestions for class activities as well as an instructor's manual and test bank. Students of the New Testament will find this introductory text both informative and engaging""--Publisher description.  Read more... ",https://1lib.in/dl/3559816/fe5000,430,Baker Academic,2013,english,"PDF, 33.24 MB"
"The Encyclopedia of Eastern Philosophy and Religion: Buddhism, Hinduism, Taoism, Zen — A Complete Survey of the Teachers, Traditions, and Literature of Asian Wisdom",Ingrid Fischer-Schreiber,https://covers.zlibcdn2.com/covers100/books/b8/f9/e8/b8f9e83989d3dc38ba9ab25641acc5b3.jpg,"
                    Translated from 1986 German edition.                ",https://1lib.in/dl/3639509/721693,486,Shambhala,1989,english,"PDF, 53.44 MB"
The message of the Prophets : a survey of the prophetic and apocalyptic books of the Old Testament,J. Daniel Hays,https://covers.zlibcdn2.com/covers100/books/cf/6d/7d/cf6d7d4455f09f43de075be88158fdf8.jpg,"
                    Christians sometimes approach the Old Testament with a mixture of awe and bewilderment, knowing that it contains pearls of wisdom, but unsure how to dive for them ... especially when it comes to the Prophets.In The Message of the Prophets, author J. Daniel Hays offers a scholarly, yet readable and student-friendly survey of the Old Testament prophetic literature that presents the message of each prophet in its historical and its biblical context and then tracks that message through the New Testament to challenge readers with what it means for them today. Hays focuses on synthesizing the message of the prophets, which enables students to grasp the major contours of the prophetic books clearly and concisely. Hundreds of colorful pictures help to illustrate the historical and cultural background of the prophets. After identifying what the message meant for ancient Israel, Hays helps the readers to move toward theological application today, helping readers to gain a better understanding of God and the relationship between God and his people. The Message of the Prophets is essential for professors, students, and others seeking to understand the role that the OT prophets play in the Christian faith.                ",https://1lib.in/dl/5236952/c082d6,384,Zondervan,2010,english,"EPUB, 18.65 MB"
Surveying for Engineers,J. Uren,https://covers.zlibcdn2.com/covers100/books/1f/9d/0e/1f9d0eb8dfe177b2d97fad811414beaf.jpg,"
                    The fifth edition of Surveying for Engineers sets out the essential techniques needed for a solid grounding in the subject.Covering traditional methods and the latest technological advances this popular and trusted textbook is packed with clear illustrations, exercises and worked examples, making it both a comprehensive study aid for students and a reliable reference tool for practitioners.Aimed at students studying surveying as either part of an engineering, building or construction course or as a separate discipline, the new edition includes:• the latest developments in Global Navigation Satellite Systems (GNSS)• full details on the introduction of network RTK systems and their applications • recent developments in survey instruments, methods and technologies ",https://1lib.in/dl/2860917/cdd60d,816,Palgrave,2010,english,"PDF, 8.85 MB"
Encountering the Old Testament: A Christian Survey,Bill T. Arnold,https://covers.zlibcdn2.com/covers100/books/06/03/66/060366fe30b678599211297c2f655031.jpg,"
                    This new edition of a bestselling evangelical survey of the Old Testament (over 180,000 copies sold) has been thoroughly updated and features a beautiful new interior design. It is lavishly illustrated with four-color images, maps, and charts and retains the pedagogical features that have made the book so popular:· chapter outlines, objectives, and summaries· study questions· sidebars featuring primary source material, ethical and theological issues, and contemporary applications· lists of key terms, people, and places· further reading recommendations· endnotes and indexesThe book is supplemented by web-based resources through Baker Academic's Textbook eSources, offering course help for professors and study aids for students.                ",https://1lib.in/dl/3487439/89c13a,560,Baker Academic,2015,english,"PDF, 37.13 MB"
Atmospheric Science: An Introductory Survey,John M. Wallace,https://covers.zlibcdn2.com/covers100/books/01/99/e0/0199e081a1a7ed2147590cb6fb36de72.jpg,"
                    Wallace and Hobbs’ original edition of Atmospheric Science helped define the field nearly 30 years ago, and has served as the cornerstone for most university curriculums. Now students and professionals alike can use this updated classic to understand atmospheric phenomena in the context of the latest discoveries and technologies, and prepare themselves for more advanced study and real-life problem solving.Atmospheric Science, Second Edition, has been completely revamped in terms of content and appearance. It contains new chapters on atmospheric chemistry, the Earth system,climate, and the atmospheric boundary layer, as well as enhanced treatment of atmospheric dynamics, weather forecasting, radiative transfer, severe storms, and human impacts, such as global warming. The authors illustrate concepts with colorful state-of-the-art imagery and cover a vast amount of new information in the field. They have also developed several online materials for instructors who adopt the text. ",https://1lib.in/dl/511111/2fa4b7,505,Academic Press,2006,english,"PDF, 50.37 MB"
Nationalism and modernism: a critical survey of recent theories of nations and nationalism,Prof Anthony D Smith,https://covers.zlibcdn2.com/covers100/books/f3/52/f6/f352f6fbbf1cbd8ba74e6b29d602e0e5.jpg,"
                    This book represents a much-needed analytical survey of current theories of nationalism by one of the leading authorities in the field. It contextualizes the new insights into nationalism and its relationship with states and state-building on one hand, and ethnicity and ethnic revival on the other. Anthony Smith assesses the contributions of key figures in the field. Given the extent of nationalist and ethnic phenomena and the diversity of approaches which have been put forward, Smith's accessible account will prove an indispensable guide.                ",https://1lib.in/dl/541043/f83b1c,285,Routledge,1998,english,"PDF, 1014 KB"
Excel for Scientists and Engineers - Numerical Methods,E. Joseph Billo,https://covers.zlibcdn2.com/covers100/books/35/bd/31/35bd315e07c8ca69713d684d9f0ac4f1.jpg,"
                    Learn to fully harness the power of Microsoft ExcelR to perform scientific and engineering calculationsWith this text as your guide, you can significantly enhance Microsoft Excel'sR capabilities to execute the calculations needed to solve a variety of chemical, biochemical, physical, engineering, biological, and medicinal problems. The text begins with two chapters that introduce you to Excel's Visual Basic for Applications (VBA) programming language, which allows you to expand Excel'sR capabilities, although you can still use the text without learning VBA. Following the author's step-by-step instructions, here are just a few of the calculations you learn to perform:    * Use worksheet functions to work with matrices    * Find roots of equations and solve systems of simultaneous equations    * Solve ordinary differential equations and partial differential equations    * Perform linear and non-linear regression    * Use random numbers and the Monte Carlo method                ",https://1lib.in/dl/486699/b44cfe,477,Wiley-Interscience,2007,english,"PDF, 31.49 MB"
"Numerical Algorithms: Methods for Computer Vision, Machine Learning, and Graphics",Justin Solomon,https://covers.zlibcdn2.com/covers100/books/fe/23/34/fe2334473cf6e8596c53f9356bc26203.jpg,"
                    Numerical Algorithms: Methods for Computer Vision, Machine Learning, and Graphics presents a new approach to numerical analysis for modern computer scientists. Using examples from a broad base of computational tasks, including data processing, computational photography, and animation, the textbook introduces numerical modeling and algorithmic design from a practical standpoint and provides insight into the theoretical tools needed to support these skills.

The book covers a wide range of topics―from numerical linear algebra to optimization and differential equations―focusing on real-world motivation and unifying themes. It incorporates cases from computer science research and practice, accompanied by highlights from in-depth literature on each subtopic. Comprehensive end-of-chapter exercises encourage critical thinking and build students’ intuition while introducing extensions of the basic material.

The text is designed for advanced undergraduate and beginning graduate students in computer science and related fields with experience in calculus and linear algebra. For students with a background in discrete mathematics, the book includes some reminders of relevant continuous mathematical background.                ",https://1lib.in/dl/2619760/7dc671,400,CRC Press,2015,english,"PDF, 10.08 MB"
